131840197,U1PC113X,PathVision,Yatheendra Nath Reddy Devasani,yatheendranathreddydevasani@gmail.com,+917672076329,1,2,7,"Indian Institute of Information Technology ,Sri City, Andhra Pradesh",,2,,Internet of Things (IoT),2027,1,false,2025-08-23 00:07:11,PathVision Innovations Pvt Ltd,"“Path Vision Innovations is a deep-tech startup creating intelligent, scalable solutions for real-world challenges in mobility and agriculture. Our flagship products include an AI-powered Intelligent Mobility Assistance System (IMAS) for safer roads and AgriPulse360, an IoT and AI-driven platform for smarter farming. We focus on innovation, affordability, and sustainability, delivering technology that enhances safety, productivity, and quality of life for communities across India and beyond.”",NA,08/01/2025,Proddatur,"https://www.linkedin.com/in/yatheendra-nath-reddy/
https://www.linkedin.com/in/bhavya-sri-jonnala/
https://www.linkedin.com/in/karunyaallu/
https://www.linkedin.com/in/sidhartha-r-a5290524b/
https://www.linkedin.com/in/kalyan-suddala-728b87339/
https://www.linkedin.com/in/n-kalyan-reddy-851b67342/
https://www.linkedin.com/in/rohithyb20/",No,7672076329,DeepTech,Prototype,"India faces a surge in road violations, unsafe driving practices, poor fleet visibility, and neglected infrastructure, especially in tier-2/3 cities and rural areas. Traditional solutions are expensive, fragmented, or inaccessible to small and mid-sized transporters. This leads to high accident rates, inefficient fleet management, and delayed infrastructure maintenance. There is a growing market and societal need for an affordable, retrofittable, AI-driven system that ensures road safety, real-time monitoring, and proactive decision-making. IMAS bridges this critical gap with a scalable, low-cost solution that empowers fleet operators, public authorities, and communities to enhance mobility, safety, and infrastructure accountability.","India faces a surge in road violations, unsafe driving practices, poor fleet visibility, and neglected infrastructure, especially in tier-2/3 cities and rural areas. Traditional solutions are expensive, fragmented, or inaccessible to small and mid-sized transporters. This leads to high accident rates, inefficient fleet management, and delayed infrastructure maintenance. There is a growing market and societal need for an affordable, retrofittable, AI-driven system that ensures road safety, real-time monitoring, and proactive decision-making. IMAS bridges this critical gap with a scalable, low-cost solution that empowers fleet operators, public authorities, and communities to enhance mobility, safety, and infrastructure accountability.","IMAS (Intelligent Mobility Assistance System) is a modular, AI-powered hardware-software solution designed to retrofit any vehicle or roadside setup. It offers Smart Violation Detection, Vehicle Monitoring and Driver Scoring, and Road Infrastructure Monitoring through computer vision, camera/sensors, and edge AI. The system utilizes low-cost components and cloud connectivity to provide real-time alerts, dashboards, and data-driven insights via telematics. Built for scalability and ease of deployment, IMAS is ideal for government fleets, logistics companies, and personal/public transport, providing a unified, affordable, and intelligent assistance system for safer roads and more efficient transportation infrastructure.","We are selling to fleet operators, logistics companies, government and municipal transport agencies, and rural public transport services that demand cost-effective safety and monitoring solutions. Our primary customers include heavy and medium vehicle fleet managers in logistics, mining, oil & gas, and passenger transport sectors, where compliance, driver safety, and asset protection are critical.

Additionally, we target government-operated vehicles such as public buses, school transport, emergency services, and smart city projects that require real-time telematics, accident prevention, and safety compliance under India’s evolving road safety regulations.

For B2C, we aim at private vehicle owners and small fleet operators in rural and semi-urban regions who seek affordable retrofit solutions without replacing existing vehicles.

India’s commercial fleet industry is growing at a CAGR of 14–15%, and government initiatives like AIS-140 mandate GPS and emergency alert systems for public transport. Our Intelligent Mobility Assistance System (IMAS) meets these regulatory requirements while offering advanced features like face & seatbelt detection, pothole alerts, and V2V safety at a fraction of the cost of global ADAS systems. This makes IMAS ideal for cost-conscious markets while ensuring compliance, safety, and efficiency.",0,0,0,4800000,https://drive.google.com/drive/folders/1AiWeVnVKGjotzg-vO31YxgC-4nRlug4Y?usp=drive_link,Yes,https://drive.google.com/drive/folders/1AiWeVnVKGjotzg-vO31YxgC-4nRlug4Y?usp=drive_link,"I have been working on a project in the field of intelligent mobility and advanced driver assistance systems. The core idea is to integrate AI with automotive communication and sensing technologies to improve road safety and driving efficiency. The system focuses on analyzing real-time data from vehicles and surrounding environments, enabling predictive safety alerts, monitoring driver behavior, and assisting in decision-making during critical situations.

It combines aspects of computer vision, embedded systems, and AI-driven communication protocols, making it suitable for next-generation vehicles and intelligent transport infrastructure.","We understand that real impact in mobility and agriculture requires solutions that are not just technologically advanced but also practical, affordable, and tailored for diverse Indian conditions. Many companies focus on standalone features or premium products, but we recognize that success lies in an integrated, adaptive ecosystem. Our approach blends AI, IoT, and data analytics to deliver predictive, preventive, and user-friendly solutions that work even in resource-constrained environments.

For Intelligent Mobility Assistance, we know that India’s road safety challenges require retrofit-ready, cost-effective systems that can be deployed across mixed vehicle types, unlike competitors who focus only on high-end cars.

For agriculture, we understand that farmers need a one-stop platform that combines crop advisory, market access, and financial guidance, rather than fragmented tools. Our deep insight into user behavior, multilingual accessibility, and offline-first design sets us apart.

We don’t just build technology; we build trust and adoption by solving the last-mile challenges that others overlook.",NA
131841102,UP46O25A,Mailwave,Vinayak Verma,f20230736@goa.bits-pilani.ac.in,+917488853296,1,2,8,"BITS Pilani, K K Birla Goa Campus",,5,,Electronics and Communication,2028,1,false,2025-08-22 23:39:12,Mailwave,"MailWave is the single window where email meets your CRMs, task managers, and automations so work just flows.",https://mailwave.io,10th March 2023,Patna,"http://linkedin.com/in/vinayak-verma-1847181b3
http://linkedin.com/in/harsh-khandelwal-a5329320b",Yes,7488853296,DeepTech,Prototype,"Email has become the messy hub of modern work, but it doesn’t talk to the tools where actual work happens CRMs, task managers, and collaboration apps. This forces teams into endless context switching, manual follow-ups, and lost productivity. MailWave solves this by unifying email and workflows into a single intelligent window that automates busywork and keeps everything in sync.","Email has become the messy hub of modern work, but it doesn’t talk to the tools where actual work happens CRMs, task managers, and collaboration apps. This forces teams into endless context switching, manual follow-ups, and lost productivity. MailWave solves this by unifying email and workflows into a single intelligent window that automates busywork and keeps everything in sync.","MailWave’s unique solution is to transform email from a passive communication channel into an active command center for work by directly connecting it with CRMs, task managers, and other business applications. When an email arrives, MailWave can automatically update records, assign tasks, or trigger workflows without requiring the user to switch tabs, removing the constant friction of moving between disconnected tools. At the same time, it handles repetitive actions in the background such as rescheduling meetings, sending acknowledgments, and managing follow ups, which eliminates clerical busywork and ensures nothing slips through the cracks. This combination of deep integrations and intelligent automation allows teams to run their entire workflow from a single window, keeping communication and execution seamlessly linked and unlocking productivity at scale.","We are selling to startups, small businesses, and growth stage companies that rely heavily on email alongside CRMs, task managers, and other business tools. Our early focus is on teams that struggle with context switching and manual busywork in sales, operations, and customer support, where productivity gains from automation and integration are most immediate.",0,NA,NA,"40,00,000",https://drive.google.com/file/d/1LxrCAcpQ0UiZxeQr9S7fJK6GXQ1vFeMo/view?usp=drivesdk,No,https://drive.google.com/file/d/1bIyUwaYd6N6UrDf9wGZZk7S5bhEEfXVL/view?usp=drivesdk,We built an application that allows people works on top of youtube helping you focus and increase your productivity,AI is meant to do away with your repetitive tasks. Not to create any non meaningful features. With Mailwave our aim is to make sure you dont have to spend as much time on your inbox and other operations that you used to.,None
131850491,UBO99Y86,Vytal,Dhruv Goswami,f20240760@pilani.bits-pilani.ac.in,+917859835814,1,2,8,"Birla Institute of Technology & Science, Pilani Campus",,5,,Computer Science and Engineering,2029,1,false,2025-08-25 23:39:28,VYTAL,"The Blinkit of healthcare: fast, tech-driven, and on demand",NA,NA,PILANI,"https://www.linkedin.com/in/dhruvpgoswami/

https://www.linkedin.com/in/harshdudhatra/

https://www.linkedin.com/in/samruddhijain12/

www.linkedin.com/in/keshavkaushikiim",No,+91 78598 35814,HealthTech,Ideation,"India's urban healthcare landscape has a service void between overburdened primary care clinics and ERs for critical cases. This gap leaves millions grappling with uncertainty, inconvenience, and anxiety when faced with urgent but non-life-threatening medical needs. VYTAL is engineered to fill this void, introducing a new category of  ""Healthcare at home"". Accessing primary and urgent care in urban India is filled with friction. The typical patient journey for a non-emergency but urgent issue such as a sudden high fever, a minor injury, or an alarming symptom for a chronic condition involves a series of inconvenient and stressful steps.Patients often resort to risky self-diagnosis, endure long waiting times at crowded clinics, or face the high cost and anxiety of an unnecessary visit to a hospital emergency room. This systemic inefficiency creates a significant, unaddressed market need.","While government-run services like 108 EMRI provide a critical safety net, they are designed for high-acuity emergencies and patient transport, not for on-the-spot diagnostics and treatment of less severe issues. The average response time for the 108 service in Gujarat is 19 minutes, which, while commendable, underscores its focus on transport rather than immediate at-home care. National data suggests even longer response times in other areas, highlighting a nationwide opportunity for a faster, more specialised service layer. This leaves a vast ""service void"" for the majority of day-to-day medical concerns that fall between a routine check-up and a life-threatening event.
The current urban healthcare system is highly fragmented. A doctor's consultation, a diagnostic test at a lab, and a pharmacy purchase are typically disconnected events. This lack of integration prevents the creation of a longitudinal health record and inhibits the potential for a proactive care loop that could prevent future health crises. This fragmentation leads to operational inefficiencies, redundant processes, and missed opportunities for preventive medicine.","We are developing a tech powered, on-demand healthcare delivery platform that dispatches paramedics to a patient's doorstep within 15 minutes. A paramedic at your home,on your demand not only provides you a sense of placebo (because of the doctors validation) and relief but also starts keeping a check on your potential health shortcomings by maintaining a database of your vitals.The on-site paramedic can act as a vital link to higher medical expertise. Using the paramedic's field app, they can facilitate an immediate and secure video consultation between the patient and a remote physician.The database will be maintained through the regular health checkups the patient can take through our services. Hence VYTAL also helps to make a preventive medicine system because it is designed to bridge this ecosystem void by integrating you test reports,doctor consultation, regular vital checks and medicine into a single, seamless platform. We also aim to seamlessly sync with a wide range of consumer-grade, home-installed health monitoring devices, such as Bluetooth-enabled blood pressure cuffs and glucometers. This continuous stream of patient-generated health data is crucial for our proactive and preventive care models, allowing for long-term health trend analysisWe are fundamentally shifting healthcare from a destination one must travel to, into a service that is available anytime, anywhere, on demand.","A typical person on our platform could be anywhere from a 80 year old to a family with a newly born.India has a large and growing elderly population. In Gujarat alone, 51.3% of senior citizens suffer from at least one chronic disease, with hypertension (24.3%) and diabetes (12.4%) being the most prevalent.Patients with these conditions require regular monitoring of vitals such as blood pressure and glucose levels. The current process is cumbersome and reactive, relying on periodic clinic visits.
This demographic faces significant mobility challenges, making frequent and often physically taxing trips to clinics for routine monitoring a major burden. This same patient has adult children who living away from their aging parents.This demographic possesses disposable income and is highly motivated to ensure the well-being of their loved ones.
And then there comes the upcoming health conscious population who have disposable income to spend on their health for Gym trainers, sleep trackers, whoop bands etc. We will cater to this audience by reducing the mess they wanna avoid by going to a hospital and booking a health checkup, maybe even lining up in queues for those tests to be conducted. Instead they could get their tests done, reported and consulted via teleconsultation via their phones itself on a weekend.",NA,NA,NA,NA,https://drive.google.com/file/d/1xas3X13fNkVkf8JhrdOwjydmu099Idfu/view?usp=drive_link,Yes,https://drive.google.com/drive/folders/1apvA53wpca9MVGknhX1ZFf5exsuEh0If?usp=sharing,"Worked on a project called VARMAN which was a centralised platform that manages your vaccination hassle by keeping a check on the availability, vaccine info, history, dose dates.
The project got selected among the top 250 applications out of 10,000 in the whole south asia region and VARMAN a KRUU ambassador of the region.
https://www.youtube.com/watch?v=xeXK13JHlFc","The inspiration for this project did not come from a business plan or a market trend, instead from a place of profound helplessness. I watched my grandparents, people who had given me so much, become defined by their chronic illnesses. The constant doctor visits, the confusing medications, the exhaustion of navigating a broken system was an emotional toll as much as a physical one.

This feeling hit even closer to home when I thought about my parents. The terrifying realisation that in a decade, they could be facing the same issues is what truly scared me. When you hear that you're prediabetic, there's a moment of reckoning. You realise there's no going back to the way things were. The only way forward is to take control, to act on your regular health checkups before a full-blown diagnosis is the only solution.
Our business isn't just about managing health; it's about providing a support system for their life. It's about giving them the clarity and the tools to be proactive, so they can live with confidence instead of fear. We're here to ease the emotional burden of navigating chronic illness, not just the physical one. We understand that behind every health metric is a human being with a life they want to protect. That's a perspective no other company has.Our customers aren't just patients; they are sons and daughters, fathers and mothers, all seeking to avoid that devastating feeling of helplessness. They want to know that no matter what comes, they are ready for it, not just with a plan, but with a sense of security and relief.",Nope
131859851,U44VS68G,Amplify,Mohit Jaiswal,mohitjaiswal.riverside@gmail.com,+916354551528,1,2,6,"Vellore Institute of Technology (VIT), Vellore",,4,,Computer Science and Engineering,2029,1,false,2025-08-19 23:39:02,Amplify,Data-driven feedbacks for brands directly from their consumers,NA,Working on it since past 2 years. But company is yet not incorporated.,"VIT Vellore, Vellore, Tamil Nadu","Mohit Jaiswal, Founder and CEO: https://www.linkedin.com/in/mohit-jaiswal-71a425299/
Jashith Masand, Co-Founder and COO: https://www.linkedin.com/in/jashith-masand-0b42b7377/",No,6354551528,Others,Prototype,"All brands in the world continuously need consumer data to understand their consumers emotions, needs, as well as get their genuine feedbacks and incorporate those actionable insights into their existing products.

However, there lacks a platform to connect brands directly with their consumers.","All brands in the world continuously need consumer data to understand their consumers emotions, needs, as well as get their genuine feedbacks and incorporate those actionable insights into their existing products.

However, there lacks a platform to connect brands directly with their consumers.","A global data-driven platform that provides actionable insights to brands in the form of video feedbacks directly from their consumers.
Here, Brands get the data and feedbacks they exactly want, not some random data and feedbacks that the customer is giving currently in Amazon, Flipkart, etc.

In the app, users will first pick a product category (like smartphone), then choose the brand, and after that, select the specific model they use, then they will upload:
1) A Video recording in which they will show their face, the product and answer 4 questions:
-->Why did you buy this product?
-->Why did you choose this brand?
-->What’s one thing you like most about the product?
-->What’s one thing you dislike most about the product?
2) Answer a questionnaire where they will rate the product on scale of 1 to 5 based on different parameters (like battery life)","All brands in the world across all product categories.
Our USP:
1)Access to Competitor Feedback: Brands can also view feedback from customers of their competitors.
2)Incentives for Consumers: People get paid for uploading their feedback, so they’re motivated to participate.
3)Targeted Insights: Brands receive the exact kind of feedback and data they’re looking for — not just random or general responses.",0,NA,NA,2000000,https://drive.google.com/file/d/1Whf9O-fmsLWcuAZ9CFBY6stcQyDTFBh7/view?usp=sharing,Yes,"Pitch deck: https://docs.google.com/presentation/d/16pZKTRsaTrH4sBwMftD-bHmZ7WEi_ddsB11JHBNXqXA/edit?usp=sharing
Founder's introduction video: https://drive.google.com/file/d/18aoibUUvMc2tbypBZdLkNFa5gENlyeD2/view?usp=drive_link","I, Mohit, built an app called “Book My Space” for my school in Grade 11 to solve the problem of classroom and lab scheduling. Earlier, teachers relied on a WhatsApp group to request and book spaces, which often led to confusion and clashes. Our school has 20+ different spaces in addition to regular classrooms — including labs, halls, and activity areas — where teachers conduct classes and sessions.

To address this, I created a simple mobile app where teachers could check availability and reserve spaces in real time. The app is actively used by 40+ teachers on a daily basis, has streamlined scheduling conflicts, and gave me my first hands-on experience in identifying a real problem, building a tech solution, and seeing it make an impact in a live environment.","The feedbacks currently received by companies consists majorly of generic surveys and responses. We understand that feedback is far more powerful when it is authentic, emotional, and visual. A video captures tone, sentiment, and context that numbers never can.

We also recognise that brands don’t just need data; they need actionable insights and credible content they can use to improve products and marketing. Our business uniquely combines consumer psychology, video authenticity, and data intelligence to deliver both — which is why we are not just a feedback tool, but a growth engine for brands.",None.
