133599780,U62Y5L3G,Xs parking solution,Dev Raghuraj,devraghuraj27@gmail.com,+919896871821,1,2,6,"Birla Institute of Technology & Science, Pilani Campus",,4,,Computer Science and Engineering,2026,1,false,2025-08-24 22:27:18,Xs-Parking Solution,"Xs-Parking Solution app offers a smart , digital solution to locate , book and pay for parking spots.",NA,01/03/2025,"B-35 ANSAL TOWN , REWARI , HARYANA",https://www.linkedin.com/in/dev-raghuraj-b77b38237?utm_source=share&utm_campaign=share_via&utm_content=profile&utm_medium=android_app,Yes,9896871821,Others,Validation,"Parking in busy cities and popular destinations has become a daily struggle, causing frustration, wasted time, and unnecessary fuel consumption. Drivers often circle around in search of a spot, only to end up parking far from their destination, leading to delays and added stress. Our parking app addresses these issues by providing a seamless digital solution that allows users to pre-book parking spaces, view real-time availability, and make secure digital payments.","Parking lot owners face challenges in managing their spaces efficiently, losing potential revenue due to lack of visibility, poor occupancy management, and limited payment options. This will help owners optimize space utilization, attract more customers, and standardize operations. By bridging this gap, we are not just solving a daily inconvenience but also contributing to smoother urban mobility and a smarter, more efficient parking ecosystem.","Our startup introduces a tech-enabled solution to address the persistent issue of urban parking inefficiency. Through our mobile application, users can discover and pre-book available parking spaces in real-time, ensuring hassle-free and time-saving parking experiences. What makes our innovation unique is its ability to digitize and optimize underutilized parking spots — including those in residential, commercial, and institutional areas — turning idle spaces into shared public assets. This system not only reduces traffic congestion and vehicular emissions caused by circling for parking, but also supports smart city objectives by integrating location tracking, digital payments, and real-time availability updates. Our approach aligns with government goals around urban planning, environmental sustainability, and digital public infrastructure, making it a scalable, citizen-centric innovation with direct social and economic impact.","Our solution has wide-ranging applications across multiple sectors: 1.Religious Places Temples: Helps manage high parking demand during peak hours and weekends by offering pre-booking and organized space allocation. 2.Urban Mobility Smart Cities: Ideal for municipal bodies aiming to digitize parking infrastructure and reduce congestion as part of smart city initiatives. 3.Commercial Complexes Malls: Helps businesses manage visitor parking efficiently while generating additional revenue. 4.Residential Societies Gated Communities: Enables residents to manage guest parking and lease unused spaces. 5.Transportation Hubs (Airports, Railway Stations): Streamlines parking for high-footfall areas by reducing wait times and improving traffic flow. 6.Corporate IT Parks: Assists facility managers in organizing employee and visitor parking using real-time data.",0,NA,NA,10 Lac,https://drive.google.com/file/d/1ZZtlcN-Pd6nkLvmSMWRFtEm-eWmuPQ6t/view?usp=drive_link,No,https://drive.google.com/drive/folders/1ZY0X6qwmOdxo05fjxU4UrJ3PXisWyM3o?usp=drive_link,"Designed and developed a full-stack healthcare application that enables users to purchase medicines, schedule doctor appointments, and access various healthcare services. Built RESTful APIs for secure data exchange, implemented database schemas for scalable storage, and integrated payment gateways for seamless transactions. Developed a dedicated admin panel for managing inventory, approving doctor listings, monitoring orders, and analyzing platform performance. Implemented user authentication with role-based access control, data encryption, and compliance with healthcare data privacy standards. Optimized front-end performance and ensured system reliability, fault tolerance, and scalability.","We see parking as an unorganized ecosystem—not just an inconvenience. Most players focus only on the driver’s side, but we recognize the dual challenge: for consumers, it means wasted time, stress, and inefficiency, while for owners it results in underutilized space, lost revenue, and lack of digital tools, for this we have developed two separate apps. We see a massive untapped opportunity in Tier-2 markets, high-footfall tourist spots, and devotional hubs where the pain is more severe. We also treat parking as a standardized, scalable asset class—introducing uniform layouts, digital payments, and trusted operations. By catering to India’s mix of cash and digital preferences, we are not only solving today’s inconvenience but also building the foundation for the future of mobility and smarter cities.","Beyond funding, how do you support the start-ups (network, mentorship, partnerships, strategy) under this program ?"
133606519,UVR2G631,VDocs,Arpita Singh,singh.arpita5473@gmail.com,+919931859762,1,2,6,"Amity School of Engineering & Technology (AMITY), Noida",1,4,,Computer Science and Engineering,2025,1,false,2025-08-24 12:33:12,VDocs,"Digital health vault for reports & AI insights, simplifying healthcare with easy storage, analysis, and ABDM-ready integration for all.",https://vdocs.in/,Jan 2025,"Delhi-NCR, India",Arpita Singh (Founder) - https://www.linkedin.com/in/arpitasingh133/,Yes,9931859762,HealthTech,Prototype,"Healthcare in India is still heavily dependent on paper-based reports and fragmented systems. Patients often struggle to keep track of their past medical history, lab results, and prescriptions, while doctors waste valuable consultation time trying to piece together incomplete information. This creates inefficiencies, delays in treatment, and in many cases, serious gaps in continuity of care.

Labs and clinics also face challenges in engaging patients beyond a single visit, since there is no simple way to offer digital access to reports or build long-term trust. On top of this, the lack of standardization and integration with national frameworks like ABDM makes it harder to move towards a fully digital ecosystem.

VDocs solves this by providing a secure digital health vault where patients can store, access, and share their reports anytime. Our AI layer helps them track key vitals, identify trends, and get preventive insights without replacing doctors. Clinics and labs benefit from offering patients a modern digital experience, strengthening retention and enabling ABDM-compliant data flows.

By eliminating paperwork, ensuring secure continuity of care, and making health data truly patient-centric, we bridge the gap between patients, doctors, and healthcare providers in a simple, accessible way.","Healthcare in India is still heavily dependent on paper-based reports and fragmented systems. Patients often struggle to keep track of their past medical history, lab results, and prescriptions, while doctors waste valuable consultation time trying to piece together incomplete information. This creates inefficiencies, delays in treatment, and in many cases, serious gaps in continuity of care.

Labs and clinics also face challenges in engaging patients beyond a single visit, since there is no simple way to offer digital access to reports or build long-term trust. On top of this, the lack of standardization and integration with national frameworks like ABDM makes it harder to move towards a fully digital ecosystem.

VDocs solves this by providing a secure digital health vault where patients can store, access, and share their reports anytime. Our AI layer helps them track key vitals, identify trends, and get preventive insights without replacing doctors. Clinics and labs benefit from offering patients a modern digital experience, strengthening retention and enabling ABDM-compliant data flows.

By eliminating paperwork, ensuring secure continuity of care, and making health data truly patient-centric, we bridge the gap between patients, doctors, and healthcare providers in a simple, accessible way.","Our unique solution is a digital health vault built for the Indian healthcare ecosystem, designed to be simple for patients and seamlessly integrable for clinics and labs. Unlike generic health apps, VDocs focuses on solving the core problem of paper-based, fragmented medical records.

Patients can securely store, access, and share all their health reports in one place, with AI-powered insights that track vitals, highlight trends, and encourage preventive action. This gives them continuity of care and empowers them to actively manage their health.

For clinics and labs, VDocs offers an easy plug-and-play platform to deliver digital reports, manage appointments, and build stronger engagement with patients. Our solution is ABDM-ready, ensuring future-proof integration with national health frameworks while maintaining high standards of privacy and security.

By combining accessibility, AI-driven insights, and ecosystem integration, VDocs creates a single, patient-centric interface for healthcare in India.","Clinics & Small–Mid Labs (B2B2C):
Provide them with digital reporting & appointment booking.
Help them retain patients and offer modern digital services.

Patients (via clinics/labs):
Access to a secure digital health vault.
Track medical history, reports, and AI-driven health insights.

Doctors (indirectly through clinics):
Get complete patient history in one place.
Save consultation time and improve decision-making.",0,NA,NA,50000,https://drive.google.com/drive/folders/1oBZxa902DzyRK_SbwvLAPSc7-oqDD1cs?usp=sharing,Yes,https://drive.google.com/drive/folders/1oBZxa902DzyRK_SbwvLAPSc7-oqDD1cs?usp=sharing,"We've previously built a Relief App for an NGO during the pandemic. The app streamlined donation management and resource distribution by connecting volunteers, NGOs, and beneficiaries in real time. It enabled tracking of food, medicines, and essential supplies, ensuring transparency and efficient delivery. This project gave us first-hand experience in building scalable, impact-driven digital solutions for low-resource settings, which directly informs how we’re designing VDocs to be simple, accessible, and user-friendly for patients and healthcare providers.","Most healthtech players focus on digitizing in silos—EMRs, telemedicine, or lab aggregation—while missing that the patient must sit at the center for true continuity of care. What we understand is that adoption in India depends less on advanced tech and more on trust, simplicity, and seamless fit into existing clinic workflows. VDocs is built as a patient-centric digital vault, distributed through clinics and labs where trust already exists, making it both adoptable today and scalable tomorrow. Our unique insight is that the real moat is not just AI or storage, but becoming the default interface for every patient’s health journey, aligned with ABDM standards and usable even in low-tech settings.",NA
133621465,USYO4971,krishnasai0229,Krishna peddi,krishnasai0229@gmail.com,+918790177394,1,2,6,"Aurora Engineering College, Hyderabad",,4,,Computer Science and Engineering,2027,1,false,2025-08-24 23:49:20,LifeLogger (Working Title),"A wearable logger for voice, biometrics & context.",NA,NA,NA,"Priyanshu Sharma  - https://www.linkedin.com/in/priyanshusharmapc?utm_source=share&utm_campaign=share_via&utm_content=profile&utm_medium=ios_app 
 Krishna sai Peddi   -  www.linkedin.com/in/krishna-sai-peddi-89b1bb240",Yes,8790177394,Others,Validation,"Users seeking to log their life for productivity, self-reflection, or memory augmentation face a fragmented market. They are forced to choose between audio recorders (like PLAUD, Omni) that lack biometric context, and wellness trackers (like Oura, Whoop) that lack audio capture. Existing solutions are often cloud-dependent, compromising privacy and offline usability. There is no single, discreet wearable that holistically captures and integrates voice, biometrics, and environmental context with a privacy-first, local storage model.","Users seeking to log their life for productivity, self-reflection, or memory augmentation face a fragmented market. They are forced to choose between audio recorders (like PLAUD, Omni) that lack biometric context, and wellness trackers (like Oura, Whoop) that lack audio capture. Existing solutions are often cloud-dependent, compromising privacy and offline usability. There is no single, discreet wearable that holistically captures and integrates voice, biometrics, and environmental context with a privacy-first, local storage model.","We have designed a three-tiered line of wearable devices (Basic, Plus, Pro) that uniquely integrate high-fidelity audio capture using MEMS microphones with biometric sensors in a discreet, pendant-sized form factor. Unlike competitors, our core value proposition is user control and privacy, enabled by significant onboard microSD storage (4GB to 32GB) that eliminates dependency on a constant cloud connection. This hardware is complemented by a flexible SaaS platform that offers optional, powerful AI transcription and analysis, allowing users to choose their level of connectivity and data processing.","Our primary customers are knowledge workers, founders, researchers, creators, and individuals within the neurodivergent (ADHD) and quantified-self communities. Our insight is that these users are not just buying a gadget; they seek a frictionless ""memory amplifier"" to capture thoughts and contextual data. They are frustrated with juggling multiple devices and apps and are increasingly privacy-conscious. We cater to their need for an integrated, reliable, and private logging system that respects their data ownership.",0,0,0,0,https://drive.google.com/drive/folders/1VrjkM7pnE20bR8sMRjS2-f0SckSgqWgZ,No,https://drive.google.com/drive/folders/1VrjkM7pnE20bR8sMRjS2-f0SckSgqWgZ,"MediEase 360 was an all-in-one medical platform, integrating features of TATA 1MG and PharmEasy. It enabled patients to track prescriptions, manage records like MRIs, and procure medication. Doctors could securely share records and recommend cost-effective generic medicines. This holistic system was recognized as a top finalist in startup and incubation competitions at premier institutes including IIT Guwahati, IIM Bombay, and IIT Madras, and was selected for a startup display at IIT Roorkee.","We understand that competitors force users into a false trade-off: choose convenience (wearable form factor), audio fidelity, or privacy (local storage) but never all three. Our core insight is that the target user, a ""prosumer"" focused on self-improvement and productivity, demands an integrated solution without compromise. They want the ease of a wearable, the clarity of a dedicated recorder, and the security of local data ownership. Our hybrid hardware-SaaS model is architected around this principle of user control, a dimension that current market players, focused on locked cloud ecosystems, consistently undervalue.",no
133621739,UP93FT98,f20230871,Jaydeep Chorasiya,f20230871@pilani.bits-pilani.ac.in,+918003660901,1,2,8,"Birla Institute of Technology & Science, Pilani Campus",,5,,Chemical Engineering,2028,1,false,2025-08-27 22:55:16,Ember,"Ember is an innovative healthcare startup specializing in scientifically validated Ayurvedic burn care solutions. Our flagship product, A herbal ointment Burnicol, protected as a trade secret, offers rapid healing and infection prevention for burn injuries. We combine traditional wisdom with modern research, delivering safe, affordable, and accessible products tailored for underserved communities.",NA,NA,"Kota, Rajasthan","linkedin.com/in/jay-chaurasiya 
linkedin.com/in/snehasrivastava2108 
linkedin.com/in/satyam-jha-ab7914266 
linkedin.com/in/harshit-jaiswal-bp 
linkedin.com/in/aryan-agarwal-4343b0257",Yes,+91 8003660901,HealthTech,Prototype,"Ember is addressing the urgent and widespread problem of inadequate burn care in India, where over two million people suffer burn injuries each year. Most victims—especially in rural and low-resource regions—lack access to affordable, effective, and home-use treatments. Existing options are often costly, slow, invasive, and result in prolonged healing, high infection risk, and permanent scarring. This leaves a majority of patients underserved, leading to lifelong disabilities, emotional trauma, and severe financial hardship. Ember’s mission is to close this gap by offering innovative, accessible burn care solutions that enable faster, safer, and more affordable recovery for all.","Ember is tackling a massive unmet need in the $3B+ global burn care market. India alone reports over 7 million burn injuries annually, with second- and third-degree burns leading to 140,000 deaths and 240,000 disfigurements each year. Current treatments are expensive, invasive, and hospital-dependent—failing to serve the majority of patients in rural and low-resource areas. This leaves millions without affordable, effective, or convenient care, creating a vast underserved market. By offering a safe, non-invasive, home-use alternative that accelerates healing and prevents complications, Ember is positioned to disrupt a stagnant sector and capture significant share in both domestic and global markets.","Our solution is validated by over 20,000 customers, all-natural Ayurvedic ointment designed for rapid and effective treatment of first, second, and third-degree burns. Formulated with a proprietary blend of herbal antibacterial and anti-inflammatory agents, it provides instant pain relief, robust infection prevention, and scar minimization—all without hospitalization or costly interventions. Safe, affordable, and easy to apply, it empowers convenient home-based recovery, making it especially impactful in underserved rural communities. With its formulation safeguarded as a trade secret, the product combines clinical credibility with competitive defensibility, positioning it as a scalable alternative to conventional burn care.","Our target customers are individuals and families in need of effective, affordable, and convenient burn care—particularly in communities with limited access to quality medical facilities. We are addressing both direct consumers (burn injury patients and caregivers) and distribution partners (local clinics, pharmacies, and AYUSH healthcare providers) who seek safe, natural, and easy-to-use alternatives for treating first, second, and third-degree burns. This dual focus ensures both broad household adoption and strong integration within existing healthcare channels, driving scalable reach across urban and rural markets.","INR 60,000",NA,NA,NA,https://drive.google.com/drive/folders/1UxI4vPlHMYKxTAbuHfqi07ceZanMYhRO?usp=drive_link,Yes,https://drive.google.com/drive/folders/1UxI4vPlHMYKxTAbuHfqi07ceZanMYhRO?usp=drive_link,"Secured 1st place in an ad-making competition held at IIT Roorkee while representing Birla Institute of Technology and Science, Pilani

The challenge? Script, shoot, edit, and present a compelling video in just 24 hours-all while tackling a deeply important issue: the stigma around seeking mental health counseling among students.

Bringing this vision to life in such a short span was an intense yet incredibly rewarding experience. From brainstorming to late-night editing, every moment was a testament to the power of storytelling. Winning was an honor, but what truly matters is contributing to a cause that needs more voices, more awareness, and more change.

Details of certificates are attached in the drive folder: https://drive.google.com/drive/folders/1UxI4vPlHMYKxTAbuHfqi07ceZanMYhRO?usp=drive_link","We’re not just building a burn care brand — we’re building a platform for obscure but locally renowned medicines that have proven value in communities for decades but lack global recognition. Burn care is our first use case because it solves a massive, urgent problem in India, but our larger vision is to systematically identify, validate, and scale traditional remedies that have stood the test of time. By bridging indigenous healthcare wisdom with modern scientific validation, regulatory approval, and global distribution, we aim to unlock an entire pipeline of underutilized solutions that can transform healthcare access worldwide.",No
133628116,UX9R6L55,hitanshulokeshparekh1511,Hitanshu Parekh,hitanshulokeshparekh1511@gmail.com,+918779535198,5,1,4,Other organization not listed here,1,3,,Others,2024,1,false,2025-08-24 23:25:43,PsychHelpAI,Measure your mental health with AI,NA,NA (Working since 2024 – informal team formation),NA,"Hitanshu - www.linkedin.com/in/hitanshu-parekh-5b1758192

Priyanshu - https://www.linkedin.com/in/priyanshusharmapc?utm_source=share&utm_campaign=share_via&utm_content=profile&utm_medium=ios_app",Yes,8779535198,HealthTech,Validation,"Mental health crises are skyrocketing, yet therapy is expensive, time-consuming, and stigmatized. People hesitate to seek help because they fear judgment, lack access to quality specialists, or can’t afford recurring sessions. Current apps only provide generic “wellness tips” instead of meaningful insights about an individual’s actual cognitive or developmental state. Psychometric tools exist, but they are slow, manual, and inaccessible at scale. This leaves a massive gap: no reliable, affordable, anonymous way to measure one’s mental health early before problems escalate.","Mental health crises are skyrocketing, yet therapy is expensive, time-consuming, and stigmatized. People hesitate to seek help because they fear judgment, lack access to quality specialists, or can’t afford recurring sessions. Current apps only provide generic “wellness tips” instead of meaningful insights about an individual’s actual cognitive or developmental state. Psychometric tools exist, but they are slow, manual, and inaccessible at scale. This leaves a massive gap: no reliable, affordable, anonymous way to measure one’s mental health early before problems escalate.","PsychHelpAI is building an AI-powered framework that transforms everyday behavioral and voice data into actionable mental health insights. Unlike symptom checker apps, our system uses validated psychological logic encoded in low-code automation (N8N) to flag early cognitive distress and suggest when professional help is necessary. The platform is:
Anonymous – Users share data without fear of judgment.
Affordable – AI-based assessment costs far less than clinical screening.
Action-oriented – Encourages users to approach therapists with clearer self-understanding.
By bridging the gap between “no help” and “clinical therapy,” we give people an accessible starting point to take control of their mental health.","Our initial focus is on college students, young professionals, and highstress workforces  groups experiencing burnout, anxiety, and decision fatigue. These users need private, low cost, on-demand self-assessments to understand if they require further intervention. Over time, our solution can be licensed to colleges, corporates, and HR teams to proactively monitor well being at scale. Unlike competitors, we provide quantifiable mental health indicators, not just mood tracking, giving institutions actionable data while preserving individual privacy.",0,NA,NA,"10 lakhs (for validation, prototype refinement, and psychologist backed testing)",https://drive.google.com/drive/folders/1ql_M_LwDRq9OKeNkl83w7xeLYH4vAdMd?usp=drive_link,Yes,https://drive.google.com/drive/folders/1ql_M_LwDRq9OKeNkl83w7xeLYH4vAdMd?usp=drive_link,"It is Hitanshu""s Project , He built 
TacoTask: Privacy-first task management app built with no-code tools. Uses innovative Smart Bucket System for organizing tasks, includes end-to-end encryption, real-time sync, Pomodoro timer, and calendar. Designed for students and professionals seeking secure, simple productivity solution.","AI can meaningfully assess cognitive states when combined with structured psychological frameworks  not by acting as a “soothing chatbot,” but by conducting structured, interactive assessments that mirror real psychologist questioning.","Could you share the level of product readiness expected at later rounds?
Do you have an evaluation template to help us align our presentation better?"
