132464861,U47OQ4P0,suraj,Suraj Singh,suraj@zolix.ai,+919450563744,2,,,Zolix ai,,,16,,,1,false,2025-08-18 17:52:24,ZOLIX CLOUD INFRA SERVICES PRIVATE LIMITED,zoECON AI helps customers cut cloud costs by 60% in only 72 hours,https://zolix.ai/,03-April-2024,Bengaluru India,https://www.linkedin.com/company/zolix-ai-engine/,Yes,9450563744,Others,Pre-Seed,"On average, organizations waste 32% of their cloud resources—part of a $700B market. Our product, zoECON, supports rightsizing across Public Cloud, Private Cloud, and Kubernetes, helping customers cut both cloud and AI GPU costs. which directly help to reduce carbon footprint","On average, organizations waste 32% of their cloud resources—part of a $700B market. Our product, zoECON, supports rightsizing across Public Cloud, Private Cloud, and Kubernetes, helping customers cut both cloud and AI GPU costs.","Our unique USP is the C2O AI Engine, which recently delivered 95% more optimization recommendations than Aws, Azure , Google or Oracle cloud for a new client","Any client using IT infrastructure—Public Cloud (AWS, Azure, Google, Oracle), On-premises, or Kubernetes—can benefit from our platform. We are the only company in the market that supports all three infrastructures in a single solution",100000,NA,NA,1 Cr,https://drive.google.com/file/d/1P5lW0nNXnCZdekLIucqqt8oDD73lImx8/view?usp=drive_link,No,https://drive.google.com/file/d/1P5lW0nNXnCZdekLIucqqt8oDD73lImx8/view?usp=drive_link,"One of our team members previously led a cloud cost optimization project for a Fortune 500 client, achieving 45% savings in under 3 months by implementing automated rightsizing and AI-driven workload management","""We understand that cloud cost optimization isn’t just about lowering bills—it requires a unified approach across Public Cloud, Private Cloud, and Kubernetes. Unlike others, we combine AI-driven rightsizing with GPU cost optimization in a single platform, solving a problem competitors treat in silos",NA
132473452,UQLZ6305,mihir4use,Mihir Tomar,mihir4use@gmail.com,+919765766430,1,2,6,"Birla Institute of Technology and Science, Pilani Campus",,4,,Chemical Engineering,2026,1,false,2025-08-21 23:03:32,CarbonM Fuelmax Technology,"We are re-inventing waste to fuel technology and supply chain, to power tomorrow with yesterday’s waste.",NA,NA,"Pilani, Rajasthan","https://www.linkedin.com/in/shashwat-sharma-6ba50727b/ -Co Founder

https://www.linkedin.com/in/mihir-tomar-642ba9213/ -Founder",Yes,9373059882,DeepTech,Prototype,"Main problem we are trying to solve by our startup is access to clean, reliable and green source of fuel alterative to conventional fuels like light diesel oil. To solve this problem we need to significantly improve the infrastructure of current pyrolysis setups which produces low and inconsistent fuel, unusable for many of the industries.",.,"It will be retrofitted into existing pyrolysis setups and it will monitor real time quality of pyrolysis oil that is being produced and integrate it with process controllers, so that the pyrolysis oil is being monitored and improved in real time.

Currently there is no technology that is being implemented in current pyrolysis plants that works in close loop to improve the oil quality. There is some technology that is being used in Oil and Gas industry for quality parameters but it cannot be used in MSME’s like pyrolysis plants due to their high infrastructure and maintenance costs. While we are building a technology that is cheaper and can be retrofitted into such industries.","This is for pyrolysis plants, tire, plastic and biomass included, our technology improves the quality of fuel production during pyrolysis which profits MSME’s like pyrolysis plants, consumers which get clean, green and cheap oil and CarbonM.",0,200000-Grant,NA,₹15 Lakhs-  To build industrial lab scale product.,NA,Yes,https://drive.google.com/file/d/1XoAqcsma6u-q1ZjdcPVZOeNQyzdJziwt/view?usp=sharing,"Remaining Useful Life Prediction of an Induction Motor using Deep Learning

Created a CNN-LSTM algorithm for fault detection, classification, and predicting the remaining useful life of an induction motor achieving 
88% accuracy. 
Collaborated with BOSCH to preprocess data for their digital twin and implement the algorithm on  their motors, leading to 30% reductions 
in material costs and time.
Algorithm implemented in 5 induction motors for testing.","Currently there is no technology that is being implemented in current pyrolysis plants that works in close loop to improve the oil quality. There is some technology that is being used in Oil and Gas industry for quality parameters but it cannot be used in MSME’s like pyrolysis plants due to their high infrastructure and maintenance costs. While we are building a technology that is cheaper and can be retrofitted into such industries.

By tapping into the pyrolysis market we provide an economically and environmentally viable solution which can act as a replacement for costlier and carbon emission heavy conventional fuels.",NA
132474470,U3J7R22P,Aiyuh,Piyush Bhatnagar,help@aiyuh.com,+919005720282,2,,,Aiyuh,,,4,,,1,false,2025-08-18 22:39:15,AIYUH,"Aiyuh is a holistic wellness app that blends fitness, mindfulness, and diet, managed through AI Agent.",https://www.aiyuh.com,4th April 2025,Pune,"Piyush Bhatnagar (CTO), https://www.linkedin.com/in/piyushbhatnagarunihox/
Devdhar Kanungo (COO), https://www.linkedin.com/in/devdhar-kanungo-b65bb7145",Yes,9005720282,HealthTech,Prototype,"In today’s fast-moving world most wellness tools are siloed and one-dimensional: apps tend to focus narrowly on either fitness, nutrition, or meditation and deliver generic plans that don’t adapt to each user’s life. The result is fragmented experiences, high friction for users (too many apps, too much manual input), and limited long-term impact because recommendations aren’t personalized, contextual, or coordinated across domains.

Wearables collect rich health data, but that data often lives in separate silos and produces surface-level insights—step counts, heart-rate trends, or sleep summaries—without clear, actionable guidance. Notifications are generic, coaching is reactive rather than proactively tailored, and the ecosystem lacks a unified brain that translates signals into practical, day-by-day routines.","In today’s fast-moving world most wellness tools are siloed and one-dimensional: apps tend to focus narrowly on either fitness, nutrition, or meditation and deliver generic plans that don’t adapt to each user’s life. The result is fragmented experiences, high friction for users (too many apps, too much manual input), and limited long-term impact because recommendations aren’t personalized, contextual, or coordinated across domains.

Wearables collect rich health data, but that data often lives in separate silos and produces surface-level insights—step counts, heart-rate trends, or sleep summaries—without clear, actionable guidance. Notifications are generic, coaching is reactive rather than proactively tailored, and the ecosystem lacks a unified brain that translates signals into practical, day-by-day routines.","Aiyuh (platform)
Aiyuh is a holistic wellness platform that blends fitness, mindfulness, and nutrition into a single, personalized experience managed by an intelligent AI Agent. The system learns from your habits, preferences, wearable data, and daily check-ins to deliver adaptive workout plans, short mindfulness sessions, and meal suggestions that fit your schedule and goals. Instead of siloed apps, Aiyuh provides coordinated, context-aware routines and timely recommendations to make healthy living simple, practical, and sustainable.

Aiyuh One (wearable)
Aiyuh One is an AI-powered smartwatch that combines advanced sensors with on-device intelligence to provide real-time, personalized guidance. Unlike generic wearables that only report metrics, Aiyuh One actively adapts recommendations based on your individual physiology, daily rhythms, and emotional state—using heart-rate variability, sleep, activity, and breath signals to suggest the right exercise, recovery, or mindfulness practice at the right moment.","a)	Wellness Enthusiasts seeking holistic health.
b)	Fitness Seekers wanting personalized plans.
c)	Busy Professionals needing convenient self-care.
d)	Millennials & Gen Z focused on tech-driven wellness.",1.5 Lakh,NA,NA,INR 2 Crore,https://www.youtube.com/watch?v=CaxGbm7AOzo,Yes,https://drive.google.com/file/d/1Pn5gNecQZxnE1XfFHQzBonJelmgCDzM9/view?usp=sharing,One of our team members previously worked on developing a personalized astrology app that combined traditional astrological calculations with modern mobile-first design.,"AIYUH’s USP lies in being the first holistic wellness platform that seamlessly integrates fitness, mindfulness, and diet into a single ecosystem, guided by an AI Agent. Unlike other wellness apps or wearables that focus on isolated areas, AIYUH creates a personalized, real-time wellness journey using proprietary scoring frameworks. The app and smartwatch together act as a smart wellness companion, turning raw health data into actionable insights, routines, and recommendations. This unique blend of multi-domain integration, personalization, and adaptive AI sets AIYUH apart in the wellness market.",What strategies have worked best for health & wellness tech startups to gain early traction?
132475874,U9IQ429P,Brainiacs,Shreyas Shetty,shreyasashetty05@gmail.com,+918867766272,1,2,6,SMVITM BANTAKAL UDUPI,,4,,Computer Science and Engineering,2027,1,false,2025-08-22 00:03:10,"Altiora Innovations — Driving Innovation, Ensuring Safety.","Altiora Innovations is a forward-thinking technology startup focused on building AI-driven solutions for smarter, safer cities. Our flagship product transforms everyday dashcam footage into actionable traffic violation reports, empowering citizens, supporting authorities, and enhancing road safety. With a privacy-first, gamified, and scalable approach, we aim to create impactful innovations for today and the future.",NA,NA,NA,"https://www.linkedin.com/in/manvitha-manvitha-6b5788333
https://www.linkedin.com/in/nimishamba-m-716a0a33a
https://www.linkedin.com/in/shreyas-shetty-932322360",Yes,+91 8867766272 - Shreyas Shetty,DeepTech,Ideation,"We are tackling the problem of unsafe roads caused by rampant traffic violations, which are a major cause of accidents and fatalities in India. Current enforcement methods, such as speed cameras and government monitoring, are expensive to install and maintain, have limited coverage, and are often bypassed by violators. These systems rarely extend to rural or semi-urban areas, leaving large segments of the population without proper traffic oversight.
At the same time, millions of vehicles already have dashcams installed, capturing continuous footage of the road. However, this data is underutilized and does not contribute effectively to traffic law enforcement. Our solution addresses this gap by empowering citizens to safely and anonymously report traffic violations using their dashcam recordings.
By leveraging dashcam footage, we create a crowdsourced enforcement system that significantly expands coverage beyond traditional cameras. The system ensures privacy and safety by blurring driver faces and allowing only verified uploads with GPS and timestamp metadata. This approach increases accountability, helps authorities take action on violations, and ultimately contributes to safer roads for everyone. By turning everyday drivers into active participants in road safety, we aim to reduce accidents, save lives, and build a culture of responsible driving across India.","We are tackling the problem of unsafe roads caused by rampant traffic violations, which are a major cause of accidents and fatalities in India. Current enforcement methods, such as speed cameras and government monitoring, are expensive to install and maintain, have limited coverage, and are often bypassed by violators. These systems rarely extend to rural or semi-urban areas, leaving large segments of the population without proper traffic oversight.
At the same time, millions of vehicles already have dashcams installed, capturing continuous footage of the road. However, this data is underutilized and does not contribute effectively to traffic law enforcement. Our solution addresses this gap by empowering citizens to safely and anonymously report traffic violations using their dashcam recordings.
By leveraging dashcam footage, we create a crowdsourced enforcement system that significantly expands coverage beyond traditional cameras. The system ensures privacy and safety by blurring driver faces and allowing only verified uploads with GPS and timestamp metadata. This approach increases accountability, helps authorities take action on violations, and ultimately contributes to safer roads for everyone. By turning everyday drivers into active participants in road safety, we aim to reduce accidents, save lives, and build a culture of responsible driving across India.","We are addressing the problem of unsafe roads caused by widespread traffic violations, which are a major contributor to accidents in India. Existing enforcement methods, such as speed cameras and government surveillance, are expensive, have limited coverage, and often fail to reach rural or semi-urban areas. Meanwhile, millions of vehicles already have dashcams installed, but this valuable footage remains largely untapped for reporting violations.
Our solution leverages this existing infrastructure by empowering citizens to safely and anonymously report traffic violations using dashcam recordings. The platform is designed to support both cloud-enabled dashcams and mobile app-paired devices, allowing automatic or user-assisted uploads with GPS and timestamp metadata to ensure authenticity. AI-powered algorithms detect violations such as over-speeding, signal jumping, and helmet non-compliance, filtering false positives before human verification by authorities.
What makes our solution unique is the combination of safety, legality, and engagement: users never need to record while driving, privacy is preserved through face-blurring, and gamification elements such as points, badges, and leaderboards encourage participation. By crowdsourcing enforcement, we create wider coverage, enhance accountability, and provide law enforcement with verified evidence, ultimately contributing to safer roads for everyone.","We are primarily selling our solution to dashcam manufacturers and automotive companies, providing them with integrated software that enables citizen-driven traffic violation reporting. With millions of vehicles increasingly expected to come equipped with dashcams, manufacturers can differentiate their products by offering AI-powered, privacy-first, and gamified enforcement features pre-installed in vehicles or bundled with dashcam devices.
By partnering with automotive OEMs and car dealers, we can ensure our solution reaches end users indirectly; drivers benefit from enhanced road safety features while manufacturers gain a marketable, socially impactful product. Our platform supports both cloud-enabled and mobile app-paired dashcams, making it adaptable to a variety of hardware.
Gamification and rewards for verified reporting not only engage drivers but also increase adoption, creating a virtuous cycle of user participation and data collection. For authorities, the platform provides verified evidence and dashboards for enforcement, which adds credibility and regulatory compliance.
Ultimately, we are enabling a B2B2C model: we provide dashcam and automotive partners with the software tools to enhance their offerings, while drivers, cities, and law enforcement indirectly benefit from safer roads and wider coverage.",0,NA,NA,"We are seeking an initial investment of ₹2–5 lakhs to develop a working prototype, integrate AI-powered violation detection, and set up a pilot deployment with select dashcams. The funding will also support basic legal compliance, gamification features, and initial testing in select cities to validate the platform and demonstrate feasibility for future scaling.",https://drive.google.com/drive/folders/1JGKMicT_dRjnyLIUL02WEipEC211LlMX?usp=sharing,Yes,https://drive.google.com/drive/folders/1JGKMicT_dRjnyLIUL02WEipEC211LlMX?usp=sharing,"Project Name: Alumni Attendance Predictor – Workforce Optimization Tool
Description:
Our team collectively developed a Node.js + Express-based system to predict attendance for alumni events and optimize workforce planning. Using RSVP data, past attendance, and distance metrics, the platform recommended the required catering and seating staff, along with resources like chairs, meals, and parking, minimizing over- or under-staffing. A simple HTML frontend allowed easy alumni search by USN and visualization of predictions.
Outcome & Skills Demonstrated:
This project showcased our team’s ability to integrate data analysis, predictive modeling, and web development to solve real-world operational challenges. We collaboratively handled backend development, algorithm design, data processing, and frontend integration, demonstrating strong teamwork and technical skills. The experience reinforced our capacity to build scalable, data-driven solutions; skills we are now applying to our traffic violation reporting platform.","We understand that road safety enforcement in India cannot rely solely on traditional infrastructure like speed cameras, which are expensive, limited in coverage, and easily bypassed. Unlike other companies that focus on hardware or general dashcam apps, we see the untapped potential of existing dashcams as a crowdsourced enforcement tool. We recognize the importance of legality, privacy, and user engagement; ensuring drivers never record while driving, automatically blurring faces, and using gamification to sustain participation.
We also foresee a future where dashcams become standard in vehicles, making B2B partnerships with manufacturers and car dealers the key to scalable impact, rather than targeting end users directly. Most companies overlook this strategic approach, focusing either on consumer apps or surveillance hardware. By combining AI-powered violation detection, privacy-first design, gamified engagement, and B2B integration, we can create a platform that is practical, scalable, and culturally adapted for India, giving us an edge in both adoption and effectiveness.","What do you look for in startups that can scale not just commercially but also make a real social impact, like ours aiming to improve road safety?"
132482045,UR8J24W3,Aigirikasustainedge,Kanchika Singh,aigirikasustainedge@gmail.com,+919810190374,1,2,6,"Birla Institute of Technology and Science, Pilani Campus",,4,,Chemical Engineering,2026,1,false,2025-08-18 23:49:56,Aigirika SustainEdge Private Limited,We provide biodegradable PLA solutions for sustainable packaging.,https://aigirika.vercel.app/,January 2025,"Pilani, Rajasthan","Company: https://www.linkedin.com/company/aigirika-sustainedge/ 
Kanchika Singh: https://www.linkedin.com/in/kanchika-singh-2b4554263/
Ankit Pal: https://www.linkedin.com/in/ankit-pal-0b267a226/
Ankit Saini  https://www.linkedin.com/in/ankit-saini-here/
Akash: https://www.linkedin.com/in/akash-nayak-here/",Yes,9810190374,Others,Ideation,"Conventional plastics cause severe environmental pollution, and current biodegradable alternatives are either costly or lack performance, creating a gap for scalable, eco-friendly, and efficient plastic substitutes.","Conventional plastics cause severe environmental pollution, and current biodegradable alternatives are either costly or lack performance, creating a gap for scalable, eco-friendly, and efficient plastic substitutes.","Our unique solution is a cost-effective, high-performance PLA-based material enhanced with natural fibers for better strength, flexibility, and faster composting, making it a viable and scalable alternative to traditional plastics.","We sell to B2B customers in the packaging, FMCG, pharmaceutical, and hospitality sectors, who seek sustainable alternatives. End-users include eco-conscious consumers who benefit from safer, greener products.",0,NA,NA,1000000,https://drive.google.com/drive/folders/11UZdIUYvgVjsFz5e-XaLvNoq_3sB2Tp8?usp=sharing,Yes,https://drive.google.com/drive/folders/17Q3nrvD0bqXPj114JMIxcXXViiQRwsLY?usp=sharing,"Hydroponics Farming System – Smart Cultivation Project
Designed and implemented a data-driven hydroponics farming system to optimize plant growth without soil. The project focused on monitoring key parameters like pH, TDS, water levels, and plant health, while maintaining growth records (leaf count, height, pest/disease status) in structured formats such as Excel with photo-based tracking. Integrated automation for nutrient and water management, ensuring consistent growth conditions. The system demonstrated how AI and data analytics can be leveraged for precision agriculture, enabling higher yield, reduced resource usage, and healthier plants.","We offer a bio-based, thermally stable PLA packaging solution that meets industry standards for hot-fill applications. Our material is eco-friendly, biodegradable, and thermally enhanced, enabling companies to reduce carbon footprints without compromising performance. This helps businesses align with ESG goals, regulatory requirements, and consumer demand for sustainability, while reducing dependency on volatile petroleum markets. By offering a cost-effective, high-performance green alternative, we create value across the supply chain—from manufacturers to end-users.",Does the program include facilitation of partnerships with enterprises or institutions that can help accelerate commercialization?
132484878,U951K9CZ,f20250004,Shivani Singh,f20250004@pilani.bits-pilani.ac.in,+919335233855,1,2,6,"Birla Institute of Technology and Science, Pilani Campus",,4,,Computer Science and Engineering,2029,1,false,2025-08-22 21:49:05,ClimaZen,"1. ""Smart clothing for comfort , style & performance"". 2. "" Innovation future with advanced performance wear"". 3.""Where fashion meets smart , sustainable tech"". 4.""Revolutionizing apparel with science & design"". 5. ""Next-gen clothing crafted for every lifestyles"".",NA,NA,NA,"""I don't have a Linkedln profile right now.""",Yes,9335233855,Others,Ideation,"Most clothing today is either stylish but uncomfortable, or uncomfortable but lacking in modern features. People often struggle with outfits that feel heavy, restrict movement, or  fail to keep them comfortable in changing conditions. This makes daily wear frustrating and limits performance.
ClimaZen solves this by creating clothing that is lightweight, warm, breathable, and flexible with 4-way stretch for free movement. Our designs are made to adapt to your body and lifestyles, offering comfort without compromising style. This makes ClimaZen different from regular apparel - it's built for people who want performance and fashion together in every outfit.","ClimaZen isn't just clothing-it's an experience. Imagine outfits that feel feather-light yet keep you warm, stretch with your every move, and breathe like a second skin. We're redefining what it means to wear comfort and style together. Where others give you fashion or function, ClimaZen delivers both in one powerful package.","ClimaZen provides a unique solution by creating clothing that blends performance with style. Unlike ordinary apparel, our designs are lightweight yet warm, breathable for all-day comfort, and equipped with 4-way stretch to ensure unrestricted movement. Most brands force people to choose between fashion and functionality, but ClimaZen delivers both in one. Our focus is on durability, adaptability, and comfort, making every outfit versatile for changing needs. By combining innovation with design, we give people more than just clothes-we give them a smarter  experience of wearing something that works with their lifestyles instead of against it.","We are selling to young, dynamic individuals who value both comfort and style in their clothing. Our target customers are students, professionals, and urban youth who want outfits that adapt to their active lifestyles-lightweight for daily wear, flexible for movement, and stylish for social settings. These are people who refuse to compromise between fashion and function, and are looking for apparel that performs as good as it looks.",0,NA,NA,"""Our ask is 5 lakhs to cover raw materials, sampling, and pilot production for ClimaZen.""",Currently I have not pitch video.,No,https://drive.google.com/file/d/1YCW4q0O1AYlgcbO9ONKbBICa-_EEMAuO/view?usp=sharing,"""I don't have a past project to showcase, but I have applied my marketing skills in promoting small events and ideas, learning how to attract people and creates engagement.","What I understand about ClimaZen is that clothing is no longer just about style-it's about how it adapt to people's everyday lives. Many companies focus only on trends or on performance wear for niche users. But ClimaZen understand that people want both in one : outfits that are lightweight, warm when needed, stretch with their movements, and stay comfortable throughout the day. We are not just selling clothes, we are solving the daily struggle of choosing between comfort and fashion. This deep understanding of lifestyles-driven clothing is what sets ClimaZen apart from others.",No
