Submission Id,Team Id,team_name,Player's Name,Player's Email,Player's Mobile,User Type,Course Pursuing,Course Stream,Organisation,Course Programme,Course Duration,Work Experience,Course Specialization,Passing Out Year,player Type,Differently-abled,Submission Timestamp,Q1: Company Name,Q2: Describe your company in 50 characters,Q3: Company Website,Q4: Company Start Date,Q5: HQ Location,Q6: LinkedIn Profiles,Q7: Are the founders working on this full time?,Q8: WhatsApp Contact No. of Team lead,Q9: Which domain best applies to your company?,Q10: What stage is your company in?,Q11: What problem are you solving?,Q12: What problem are you solving?,Q13: What is your unique solution?,Q14: Who are you selling to?,Q15: Current monthly run rate,"Q16: If you raised funds, mention the last round and validation","Q17: If you raised funds, mention the last round and validation",Q18: What is your investment ask?,Q19: Upload your elevator pitch video,Q20: Can we post your elevator pitch on our social media platforms?,Q21: Attach your business deck/ pitch/ demo video,Q22: One past project of any team member (Describe briefly),Q23: What do you understand about your businesss that other companies don't?,Q24: Any questions for us?
129247391,UM8914TQ,KariGari,Abhinandan Pandey,akpandey5232@gmail.com,+918468948169,1,2,6,Dr. APJ Abdul Kalam Technical University,1,4,,Computer Science and Engineering,2028,1,false,2025-08-20 21:14:37,GroomAI,"AI-powered grooming, made personal.",groom-ai.vercel.app,19/02/2025,"New Delhi, India",https://linkedin.com/in/abhinandan-pandey1710,Yes,8468948169,HealthTech,Prototype,"Most people struggle with skincare and grooming because the market is crowded with thousands of products, conflicting advice, and a lack of clear guidance on what works for them.

What makes it worse is that everyone’s skin is unique. A product that works wonders for one person can trigger breakouts for another. Yet, most of today’s grooming recommendations are generic, leaving people to waste money on trial and error, damaging their skin, and losing trust in the process.

On the other side, brands also face a challenge, reaching the right audience who genuinely needs their products. They spend heavily on marketing, but customers often feel misled when products don’t suit them.

This gap between consumer confusion and brand communication is the core problem GroomAI solves.

By combining AI-driven personalisation with skincare expertise, GroomAI helps individuals understand their skin type, concerns, and needs, and then recommends the right products tailored to them. No guesswork. No generic advice. Just smart, personalised guidance.

In short, GroomAI simplifies grooming decisions for people and makes product discovery more authentic, helping users look and feel their best while building trust for brands.","Skincare and grooming are overwhelming today. With endless products, contradictory advice, and generic “one-size-fits-all” suggestions, people are left confused, frustrated, and often spending money on products that don’t work for them.

The truth is simple: every skin is different. What clears one person’s acne might trigger another’s. Yet, the industry continues to push broad recommendations instead of truly personalised solutions. This trial-and-error not only wastes time and money but can also harm skin health and confidence.

At the same time, brands struggle to connect with the right audience. Their products often miss the mark because customers don’t know what suits them, leading to mistrust and wasted marketing spend.

GroomAI bridges this gap. Using AI, we analyse an individual’s skin type, lifestyle, and concerns to provide personalised grooming recommendations, replacing guesswork with clarity. Consumers get tailored solutions, while brands reach people who genuinely benefit from their products.

In essence, GroomAI removes confusion from skincare, builds trust between people and products, and makes grooming smarter, simpler, and more personal.","GroomAI offers a personalised, AI-driven approach to skincare and grooming. Instead of relying on generic advice or endless trial-and-error, our platform analyses an individual’s skin type, concerns, and lifestyle to generate tailored product recommendations.

The uniqueness lies in our three-phase model:

Awareness & Knowledge – We educate users with AI-powered insights about their skin and grooming needs, cutting through misinformation.

Personalised Recommendations – Our AI matches users with the right products based on their unique profile, ensuring accuracy and trust.

E-commerce Integration – A seamless platform, like a “Zomato for skincare,” where users can instantly discover, compare, and shop products curated for them.

Unlike traditional beauty platforms, GroomAI doesn’t just show what’s trending, it shows what’s right for you. By combining deep learning with dermatological knowledge, we transform grooming into a science-backed, personalised experience.

This creates a win-win: users save time, money, and frustration, while brands gain trust and reach the right audience more effectively.

In short, GroomAI is not just a skincare recommender; it’s a smart companion that makes grooming simpler, smarter, and truly personal.","GroomAI serves two core audiences:

Consumers (Primary Focus)
Young adults and professionals (16-35 years) who are conscious about their skin, grooming, and appearance but are overwhelmed by too many product choices. This includes people struggling with acne, oily/dry skin, sensitivity, or simply those who want to look their best without wasting money on trial-and-error.

These users are digital-first, shop online frequently, and value personalised recommendations over generic marketing. For them, GroomAI acts as a personal skincare advisor available anytime.

Brands & Retailers (Secondary Focus)
Skincare and grooming companies that want to reach the right customers. GroomAI helps them showcase products directly to people who need them, reducing wasted marketing spend and building consumer trust.

By targeting both ends of the ecosystem, GroomAI creates a two-sided value chain: users get personalised guidance, and brands get authentic, effective product placement.

Initially, our focus will be on urban Indian consumers, college students, young professionals, and early adopters who already engage with digital wellness solutions. As we grow, GroomAI can expand into global markets and partner with D2C grooming brands, making personalised skincare accessible worldwide.",0,NA,NA,"We are seeking an initial investment of ₹5-10 lakhs to build our MVP, onboard early users, and validate product-market fit.",https://drive.google.com/file/d/1DMgHV7It0H0emz7XMvabe2yYway0ZeYQ/view?usp=sharing,Yes,https://drive.google.com/file/d/10_AD2JSlPVGijyDlBoOLW1Cnxadz25r9/view?usp=sharing,"Past Project – Skin Image Classifier (by Abhinandan)
As part of my AI learning journey, I built a Convolutional Neural Network (CNN) that classifies different skin conditions from images. The model achieved over 80% accuracy on a test dataset and gave me hands-on experience in computer vision, TensorFlow, and model deployment.

This project laid the foundation for GroomAI, where we’re now extending the concept from pure classification to personalised product recommendations using AI.","Most grooming and skincare companies assume customers want more choices, new products, trends, and recommendations. The truth is, customers are drowning in choices. What they want is clarity and confidence in what works for them.

We understand that grooming isn’t about following generic beauty trends. It’s about solving deeply personal problems: acne before a big interview, dryness that kills confidence, or finding products that won’t waste money or harm skin.

Where others focus on selling more products, GroomAI focuses on helping people make the right choice. That’s the gap we see: personalisation isn’t a “nice-to-have,” it’s the core need in modern grooming.

And unlike other platforms, we’re not just curating products, we’re combining AI + skin science + e-commerce into a single flow: learn your skin, get tailored advice, shop instantly.

That’s what we see, that others miss: grooming is not about “beauty marketing,” it’s about trust, personalisation, and simplicity.",NA
129325818,UL1912ZH,ZYNQ,ETANT RUSTAGI,etant280@gmail.com,+918595745141,1,2,6,"Delhi Technological University (DTU), New Delhi",,4,,Biotechnology Engineering,2029,1,false,2025-08-19 23:10:22,ZYNQ,ZYNQ: Freelancer & Influencer Matchmaking Hub for Early Startups and Brands.,NA,1-Jun-2025,Delhi and Bombay,"ETANT RUSTAGI ( DTU ) 
https://in.linkedin.com/in/etant-rustagi-2903351aa
TANUSH GOYAL ( IIT BOMBAY )
https://www.linkedin.com/in/tanush-goyal-761b35270?utm_source=share&utm_campaign=share_via&utm_content=profile&utm_medium=android_app

SOMYA SHARMA ( NSUT )
https://www.linkedin.com/in/somya-sharma-6711bb376?utm_source=share&utm_campaign=share_via&utm_content=profile&utm_medium=android_app

ANSHUL AGARWAL ( DTU )
https://www.linkedin.com/in/anshul-agarwal-853525371?utm_source=share&utm_campaign=share_via&utm_content=profile&utm_medium=android_app",Yes,8595745141,SaaS based Consumer Brands,Prototype,"Most early stage startups in India cannot afford full time employees but still need a smart mix of skills, creativity and research to grow. On the other side, Indian students and freshers struggle to earn their first income on global platforms where competition is high, payments are delayed and opportunities are limited. This creates frustration on both sides – startups cannot find reliable talent, and students cannot find the right work. ZYNQ solves this by becoming the direct bridge: startups get instant, trusted freelancers and influencers, while students get real projects, quick payments and a chance to build their career from day one.

India ke liye, India ke talent ke saath – aur duniya ke liye ready. 🌍✨","Most early stage startups in India cannot afford full time employees but still need a smart mix of skills, creativity and research to grow. On the other side, Indian students and freshers struggle to earn their first income on global platforms where competition is high, payments are delayed and opportunities are limited. This creates frustration on both sides – startups cannot find reliable talent, and students cannot find the right work. ZYNQ solves this by becoming the direct bridge: startups get instant, trusted freelancers and influencers, while students get real projects, quick payments and a chance to build their career from day one.","ZYNQ is a smart platform that

connects companies with the right freelancers and influencers, and vice versa. Companies get the best match at the most competitive price, while freelancers and influencers gain access to genuine opportunities that value their skills. Payments are fast and milestone-based, ensuring work is rewarded quickly and only after targets are achieved. It's a win-win for both sides - faster, easier, and better hiring for all","1. Early Stage Startups who cannot afford a full time employee 
2.Brands who need msicro or nano influencers with good reach for their brands but in this case the influencer is a fresher or the one who wants to begin the journey but they have a great social media impression count.
3.Student Freelancer and Influencers",50000 INR,NA,NA,450000 INR,https://youtube.com/watch?v=z8m7x2wgbpc&feature=shared,Yes,https://drive.google.com/file/d/1k2Ov-6Hf06kpV4DezYnTtrCbX4g7NVMA/view?usp=drivesdk,"Tanush Goyal and Etant Rustagi from IIT BOMBAY and DTU respectively organised Delhi's Coolest Tech Fest which was a great sucess for the students of all the schools across Delhi featuring Prominent guests like Mr. ashu Ghai.The event was featured in newspaper like Hindustan Times,Times of India and Video Media Platforms like Delhi Darpan TV. 
The event was a great sucess and Etant was the Founder Director and President of Crypticon Delhi's Coolest Tech Fest.","We understand the Indian market very deeply .
1. EARLY STARTUPS : they can't afford a full time employee but at this stage of their business tey need the best of the creativity, research and skilled team. They need a good brand name for which they need influencers who work in a affordable price.

2. Freelancer and Influencers when joining colleges need thie first earning and if they prefer freelancing in India it's quiet difficult for them to make their position on global platforms which is a very timely process and not easy and direct payments.This is where the role of ZYNQ starts.

Trust The ZYNQ Way.","Yes, We request you to share the concerned mail contact for the same."
129516795,UPDQ6261,AcquaHT Labs,Jerra Swamynathan,jerraswamynathan@gmail.com,+919390756095,2,,,AcquaHT Labs Private Limited,,,2,,,1,false,2025-08-08 13:19:13,AcquaHT Labs Private Limited,"Solar-powered water from air, plastic-free",https://www.acquahtlabs.com/,23/11/2023,"Siddipet, Telangana","1. https://www.linkedin.com/in/swamynathanjerra

2. https://www.linkedin.com/in/sai-smaran-nalla-39abb01a0/

3. linkedin.com/in/vaidhatri-sanugula-a5ab33283",Yes,+91 9390756095,DeepTech,Prototype,"AcquaHT Labs addresses the critical global water crisis affecting 2.1 billion people, including 163 million Indians who lack safe drinking water. Traditional water sources face a 15,000-75,000 year replenishment cycle, while existing Atmospheric Water Generators consume 500-600 Wh/L, making them energy-intensive and unsustainable.

The plastic pollution crisis adds another dimension—bottled water contains 240,000 nanoplastics per liter, posing significant health risks. With 680 billion liters of water evaporating daily globally (equivalent to humanity's 60-day consumption), there's immense untapped atmospheric moisture available.

India faces severe water scarcity, with 600 million people experiencing high to extreme water stress. By 2030, the global water deficit will reach 40%. Cities like Chennai, Bengaluru, and Delhi are experiencing ""Day Zero"" scenarios. Current AWG solutions are limited by high energy consumption, dependency on grid power, and inability to work efficiently in low humidity conditions prevalent in rural India and MENA regions.

Our innovation targets this multi-faceted crisis by providing decentralized, solar-powered water generation that works in low humidity (20% RH), eliminates plastic waste, and reduces energy consumption by 40% compared to existing solutions.","AcquaHT Labs addresses the critical global water crisis affecting 2.1 billion people, including 163 million Indians who lack safe drinking water. Traditional water sources face a 15,000-75,000 year replenishment cycle, while existing Atmospheric Water Generators consume 500-600 Wh/L, making them energy-intensive and unsustainable.

The plastic pollution crisis adds another dimension—bottled water contains 240,000 nanoplastics per liter, posing significant health risks. With 680 billion liters of water evaporating daily globally (equivalent to humanity's 60-day consumption), there's immense untapped atmospheric moisture available.

India faces severe water scarcity, with 600 million people experiencing high to extreme water stress. By 2030, the global water deficit will reach 40%. Cities like Chennai, Bengaluru, and Delhi are experiencing ""Day Zero"" scenarios. Current AWG solutions are limited by high energy consumption, dependency on grid power, and inability to work efficiently in low humidity conditions prevalent in rural India and MENA regions.

Our innovation targets this multi-faceted crisis by providing decentralized, solar-powered water generation that works in low humidity (20% RH), eliminates plastic waste, and reduces energy consumption by 40% compared to existing solutions.","1. Ultra-Low Humidity Aerogel Technology: Our proprietary aerogel extracts water at 20% RH (industry standard: 60%+ RH), producing 5.5g water/g, making it viable in arid regions like MENA and rural India.

2. AI-Powered Solar Hybrid System: KNN and SVM machine learning models optimize energy consumption using NASA POWER data, achieving 40% energy reduction (300 Wh/L vs 500-600 Wh/L industry standard).

3. Advanced Purification: Ozone-based water treatment provides 6.0-log pathogen kill—3,741x stronger than UV—ensuring WHO-compliant water quality.

4. Plastic-Free Ecosystem: Uses biodegradable sugarcane pulp bottles and stainless steel tanks, eliminating 240,000 nanoplastics/L found in bottled water.

5. Open-Source IoT Stack: Built with Python, Node-RED, ESP32 for transparency and collaborative improvement.

Our system produces 100-500L/day compared to competitors' 50-200L, costs ₹2-4/L versus ₹8-15/L market rates, and operates completely off-grid. This makes clean water accessible regardless of location—""because clean water shouldn't depend on your pin code"".","Our primary target segments reflect India's diverse water challenges:

Households in Water-Stressed Areas (Primary): 35 million Indians lacking safe water access, particularly in states like Karnataka, Tamil Nadu, and Maharashtra experiencing severe groundwater depletion. These customers pay ₹8-15/L for bottled water and face unreliable municipal supply.

Key Insight: Rural and peri-urban households spend 10-25% of income on water procurement. Our ₹2-4/L cost and ₹1.5-2.5L unit price offers 3-year ROI, making it economically viable.

Commercial & Institutional (Secondary): Schools, hospitals, hotels, and offices in water-scarce regions. They currently depend on expensive tanker water costing ₹50-100 per 1000L, with unreliable supply disrupting operations.

Government & NGOs (Tertiary): Municipalities implementing decentralized water solutions under Jal Jeevan Mission. NGOs serving remote communities where traditional infrastructure isn't feasible.

Unique Customer Insight: Unlike competitors focusing on high-humidity coastal areas, we've identified that 68% of water-stressed regions have humidity below 40%. Our aerogel technology uniquely serves this underserved market of 400+ million people in semi-arid regions.

Our open-source approach also attracts environmentally conscious customers seeking transparent, sustainable solutions over proprietary alternatives.",0,400000 at 13000000 Valuation with STPI Kalapataru CoE Accelerator,400000 at 13000000 Valuation with STPI Kalapataru CoE Accelerator,2000000,https://drive.google.com/file/d/1xY7KKmBt3m4UhACYTsV7e5VpA2ffob4a/view?usp=sharing,Yes,https://docs.google.com/presentation/d/18IRLOE0rQZDziHG8OninMrRf18E4GKQF/edit?usp=sharing&ouid=104469864619564671414&rtpof=true&sd=true,"1. AI-Integrated Logistics (IIT Hyderabad BUILD):
Built an AI/IoT-based supply chain solution under ISRO & Greenko leadership. Secured ₹1L seed fund; enabled AcquaHT’s smart monitoring & solar forecasting systems.

2. Water Policy Innovation (Harvard India Conference & ISB):
Designed scalable water governance models with global experts; shaped AcquaHT’s compliance & rural deployment strategies.

3. MATHack 1.0 & 2.0 (T-Hub & DST):
Among top 24 of 1,736 teams; developed AI for demand forecasting & resource optimization—now applied in AcquaHT’s KNN/SVM models.

4. Human-Carrying Quadcopter Prototype:
Engineered a personal aerial transport system; this hands-on hardware/software integration informed AcquaHT’s IoT & aerogel-based systems.

5. District Innovation Fellowship (Govt. of Telangana):
Led grassroots innovations in Siddipet; gained deep field insights that drive AcquaHT’s impact-driven approach.","The Humidity Paradox: While 95% of AWG companies target high-humidity coastal regions (60%+ RH), we discovered that 68% of water-stressed populations live in semi-arid areas with 20-40% humidity. This massive underserved market of 400+ million people has been ignored because conventional condensation technology fails below 50% RH.

Energy-Water Nexus: Traditional AWGs consume 500-600 Wh/L because they use brute-force cooling. We realized that combining aerogel adsorption with predictive AI can reduce energy by 40% while maintaining output. Our NASA POWER data integration allows predictive energy optimization that competitors lack.

Plastic-Free Economics: While others focus on water generation, we understood that the real disruption comes from eliminating the ₹60,000 crore bottled water industry through biodegradable packaging. This creates both environmental and economic moats.

Open Source Advantage: Unlike proprietary competitors, our open-source approach accelerates innovation through community contribution while building trust through transparency—crucial for water, a basic human right.

Rural-First Design: We designed for India's challenging infrastructure—intermittent power, low technical literacy, harsh environments—making our solution inherently robust for global expansion.",N/A
